ID,LEVEL,FLOOR,MOB ID,BOSS ID,NAME,DESC,
0,1,3,0|10,1,작은 숲,마을 옆에 있는 작은 숲. 조그마한 몬스터들이 부대끼며 살아간다.,
1,3,5,0|1|10,2|11,우거진 숲지,작은 숲에서 조금 더 들어가면 울창한 숲이 펼쳐진다. 조금은 워험하다.,
2,7,5,2|11,3|12,가도 경계,숲과가도의 경계선. 거대 늑대가 출몰하는 구역.,
3,10,20,0|1|2|3,4|5,슬라임 늪지,슬라임들이 살아가는 늪지. 다만 늪은 없다. 예전에는 있었다고 한다.,
4,15,25,1|2|3|4|5,6,슬라임 왕경,슬라임 엠퍼러가 산다는 전설의 연못. 도끼를 빠트리면 은도끼와 금도끼를 얻을 수 있다는 소문이 있었다.,
5,9,20,10|11|12,13|14,늑대 소굴,늑대들의 보금자리 소탕작전. 조사원의 말로는 안쪽에서 무는 용도인지 모를 제단이 발견되었다고 한다.,
6,13,25,11|12|13|14,15|16,늑대 평야,늑대들의 성지. 밤이 되면 위대한 존재의 하인이 강림한다. 신정한 사도가 내려오지 않길 바래야 할 것이다.,
7,22,15,4|5|6|13|14|15|16,17,달빛 아래 고원,늑대들의 주신 암월랑의 출몰지역. 별밤의 황홀함에 현혹되지 말어라. 그건 네 앞에 있다.,
